first,orphan,fastTrack,breakthrough,priority,accelerated,initClinicalStudy,therapeuticClass,substanceClass,moleculeType,number,name,ingredients,dateString,use,modeOfAction,innovationCategories,bla,press,trials,unii,pharmacology,target,,Inxight INN Stem,Inxight Target,Inxight ATC level 1,Inxight NPC tags,Inxight Dev Status
1,,1,,1,,?,?,chemical,?,16,Entresto,sacubitril,7/7/2015,To treat heart failure,?,?,,,,17ERJ0MKGI,,,,Alpha-1b adrenergic receptor|Alpha-2c adrenergic receptor|Dopamine D2 receptor|Dopamine D3 receptor|Serotonin 1a (5-HT1a) receptor|Serotonin 2a (5-HT2a) receptor|Serotonin 2b (5-HT2b) receptor,NERVOUS SYSTEM,,US Approved Rx
1,1,1,1,1,,?,?,chemical,?,15,Orkambi,lumacaftor,7/2/2015,To treat cystic fibrosis,?,?,,,,EGP8L81APK,,,,Neprilysin,CARDIOVASCULAR SYSTEM,,US Approved Rx
,,,,,,?,?,chemical,?,14,Kengreal ,cangrelor,6/22/2015,To prevent the formation of harmful blood clots in the coronary arteries for adult patients undergoing percutaneous coronary intervention,?,?,,,,6AQ1Y404U7,,,Platelet aggregation inhibitor(-grel-),Cytochrome P450 3A|F508del-CFTR,RESPIRATORY SYSTEM,,US Approved Rx
,,1,,1,,?,?,chemical,?,13,Viberzi,eluxadoline,5/27/2015,To treat irritable bowel syndrome with diarrhea (IBS-D) in adult men and women.,?,?,,,,45TPJ4MBQ1,,,Chemical substance(-ine),,BLOOD AND BLOOD FORMING ORGANS,ClinicalTrials.gov|HTS amenable drugs|INN|KEGG|NPC informatics,US Approved Rx
,,,,,,?,?,chemical,?,12,Kybella,deoxycholic acid,4/29/2015,"To treat adults with moderate-to-severe fat below the chin, known as submental fat",?,?,,,,005990WHZZ,,,,Delta opioid receptor|Mu opioid receptor,ALIMENTARY TRACT AND METABOLISM,,US Approved Rx
1,,1,,1,,?,?,chemical,?,11,Corlanor ,ivabradine,4/15/2015,To reduce hospitalization from worsening heart failure.,?,?,,,,3H48L0LPZQ,,,Chemical substance(-ine),Bile acid receptor FXR|Formyl peptide receptor 1|G-protein coupled bile acid receptor 1|Staphylococcus aureus,DERMATOLOGICALS,Approved drugs|FDA NDC|FDA approved|FDA human approved|Human approved drugs|NPC informatics|Structure undefined,US Approved Rx
,1,,,1,,?,?,chemical,?,10,Cholbam,cholic acid,3/17/2015,"To treat pediatric and adult patients with bile acid synthesis disorders due to single enzyme defects, and for patients with peroxisomal disorders",?,?,,,,G1JO7801AE,,,,Potassium/sodium hyperpolarization-activated cyclic nucleotide-gated channel 1|Potassium/sodium hyperpolarization-activated cyclic nucleotide-gated channel 2|Potassium/sodium hyperpolarization-activated cyclic nucleotide-gated channel 3|Potassium/sodium hyperpolarization-activated cyclic nucleotide-gated channel 4,CARDIOVASCULAR SYSTEM,Approved drugs|ClinicalTrials.gov|Community curation|HTS amenable drugs|Human approved drugs|INN|NPC screening|Structure undefined|Tariff|UK NHS,Other|US Approved Rx
1,1,,,1,,?,?,protein,?,9,Unituxin,dinutuximab,3/10/2015,To treat pediatric patients with high-risk neuroblastoma,?,?,,,,7SQY4ZUD30,,,Chimeric antibody that responds to more than one antigen(-ximab)|Monoclonal antibodies(-mab),Bile acid receptor FXR,ALIMENTARY TRACT AND METABOLISM,Approved drugs|Community curation|EMA orphan|HTS amenable drugs|Human approved drugs|NPC informatics|NPC screening|QC spectra,US Approved Rx
,1,,,1,,?,?,chemical,?,8,Cresemba,isavuconazonium sulfate,3/6/2015,"To treat adults with invasive aspergillosis and invasive mucormycosis, rare but serious infections",?,?,,,,31Q44514JV,,,,,ANTINEOPLASTIC AND IMMUNOMODULATING AGENTS,,US Approved Rx
,,1,,1,,?,?,chemical,?,7,Avycaz,avibactam,2/25/2015,"To treat adults with complicated intra-abdominal infections (cIAI), in combination with metronidazole, and complicated urinary tract infections (cUTI), including kidney infections (pyelonephritis), who have limited or no alternative treatment options.",?,?,,,,7352665165,,,,Lanosterol 14-alpha demethylase,,,US Approved Rx
,1,,,1,1,?,?,chemical,?,6,Farydak,panobinostat,2/23/2015,To treat patients with multiple myeloma,?,?,,,,9647FM7Y3Z,,,,Bacterial beta-lactamase TEM,,,US Approved Rx
,1,,,1,,?,?,chemical,?,5,Lenvima,lenvatinib,2/13/2015,"To treat patients with progressive, differentiated thyroid cancer (DTC) whose disease progressed despite receiving radioactive iodine therapy (radioactive iodine refractory disease).",?,?,,,,EE083865G2,,,Tyrosine-kinase inhibitors(-tinib),Histone deacetylase 1|Histone deacetylase 2|Histone deacetylase 3|Histone deacetylase 4|Histone deacetylase 6|Histone deacetylase 8,ANTINEOPLASTIC AND IMMUNOMODULATING AGENTS,,US Approved Rx
1,,,1,1,1,?,?,chemical,?,4,Ibrance,palbociclib,2/3/2015,To treat advanced (metastatic) breast cancer,?,?,,,,G9ZF61LE7G,,,,Fibroblast growth factor receptor 1|Fibroblast growth factor receptor 2|Fibroblast growth factor receptor 3|Platelet-derived growth factor receptor beta|Stem cell growth factor receptor|Vascular endothelial growth factor receptor 1|Vascular endothelial growth factor receptor 2|Vascular endothelial growth factor receptor 3,ANTINEOPLASTIC AND IMMUNOMODULATING AGENTS,,US Approved Rx
,1,,,,,?,?,protein,?,3,Natpara,parathyroid hormone,1/23/2015,To control hypocalcemia (low blood calcium levels) in patients with hypoparathyroidism,?,?,,,,N19A0T0E5J,,,,CDK4/Cyclin D3|CDK6/cyclin D2|Cyclin-dependent kinase 4/cyclin D1|MDA-MB-175-VII|ZR-75-30,ANTINEOPLASTIC AND IMMUNOMODULATING AGENTS,,US Approved Rx
1,,,,,,?,?,protein,?,2,Cosentyx,secukinumab,1/21/2015,To treat adults with moderate-to-severe plaque psoriasis,?,?,,,,DLG4EML025,,,Monoclonal antibodies(-mab),,"SYSTEMIC HORMONAL PREPARATIONS, EXCL. SEX HORMONES AND INSULINS",Approved drugs|Biologics|Canada|Human approved drugs|INN|NPC informatics|Structure undefined|UK NHS,US Approved Rx
,,,,,,?,?,chemical,?,1,Savaysa,edoxaban,1/8/2015,To reduce the risk of stroke and dangerous blood clots (systemic embolism) in patients with atrial fibrillation that is not caused by a heart valve problem,?,?,,,,NDU3J18APO,,,Direct Xa inhibitor(-xaban),,ANTINEOPLASTIC AND IMMUNOMODULATING AGENTS,,US Approved Rx
,1,1,1,1,1,?,?,protein,antibody,41,Opdivo,nivolumab,12/22/2014,To treat patients with unresectable (cannot be removed by surgery) or metastatic (advanced) melanoma who no longer respond to other drugs,PD-1 inhibitor,Pembrolizumab and Nivolumab are first to target PD-1,,,,31YO63LBSN,,,Monoclonal antibodies(-mab),Coagulation factor X,BLOOD AND BLOOD FORMING ORGANS,,US Approved Rx
1,1,,,1,1,2005,?,chemical,small molecule,37,Lynparza,olaparib,12/19/2014,To treat advanced ovarian cancer,PARP inhibitor,novel; first approved against this target,,,,WOH1JD9AR8,,,PARP inhibitor(-parib),,ANTINEOPLASTIC AND IMMUNOMODULATING AGENTS,,US Approved Rx
1,,1,1,1,,?,?,chemical,small molecule,38,Viekira Pak,ombitasvir,12/19/2014,"To treat patients with chronic hepatitis C virus (HCV) genotype 1 infection, including those with a type of advanced liver disease called cirrhosis","NS5A, NS3/4A, NS5B polymerase inhibitor",Same approach as other anti-HCV therapies,,,,2302768XJ8,,,Antiviral drug(-vir),Poly [ADP-ribose] polymerase 1|Poly [ADP-ribose] polymerase 2|Poly [ADP-ribose] polymerase 3,ANTINEOPLASTIC AND IMMUNOMODULATING AGENTS,,US Approved Rx
,,1,,1,,?,?,chemical,small molecule,39,Zerbaxa,ceftolozane,12/19/2014,To treat adults with complicated intra-abdominal infections (cIAI) and complicated urinary tract infections (cUTI),Cephalosporin/beta-lactamase inhibitor,Similar to many,,,,37A4IES95Q,,,Cephem-type antibiotics(cef-),Nonstructural protein 5A,ANTIINFECTIVES FOR SYSTEMIC USE,,US Approved Rx
,,1,,,,?,?,chemical,small molecule,40,Rapivab,peramivir,12/19/2014,To treat influenza infection in adults,Neuraminidase inhibitor,Similar to oseltamivir,,,,QW7Y7ZR15U,,,Antiviral drug(-vir),Bacterial penicillin-binding protein,ANTIINFECTIVES FOR SYSTEMIC USE,,US Approved Rx
1,,1,1,1,,?,?,chemical,small molecule,38,Viekira Pak,paritaprevir,12/19/2014,"To treat patients with chronic hepatitis C virus (HCV) genotype 1 infection, including those with a type of advanced liver disease called cirrhosis","NS5A, NS3/4A, NS5B polymerase inhibitor",Same approach as other anti-HCV therapies,,,,OU2YM37K86,,,Antiviral drug(-vir),Influenza A virus infection|Influenza Infection|UNIPROT:NRAM_I96A1,,KEGG|NPC informatics|Structure undefined,US Approved Rx
1,,1,1,1,,?,?,chemical,small molecule,38,Viekira Pak,dasabuvir,12/19/2014,"To treat patients with chronic hepatitis C virus (HCV) genotype 1 infection, including those with a type of advanced liver disease called cirrhosis","NS5A, NS3/4A, NS5B polymerase inhibitor",Same approach as other anti-HCV therapies,,,,DE54EQW8T1,,,Antiviral drug(-vir),,ANTIINFECTIVES FOR SYSTEMIC USE,,US Approved Rx
,,,,1,,2007,?,chemical,small molecule,36,Xtoro,finafloxacin,12/17/2014,"To treat acute otitis externa, commonly known as swimmer’s ear",Topoisomerase and DNA gyrase inhibition,Similar to other fluoroquinolone antibiotics,,,,D26OSN9Q4R,,,Quinolone-derived antibiotics(-oxacin),polyprotein,ANTIINFECTIVES FOR SYSTEMIC USE,,US Approved Rx
1,1,,1,1,1,2002,?,protein,bispecific antibody,35,Blincyto,blinatumomab,12/3/2014,To treat patients with Philadelphia chromosome-negative precursor B-cell acute lymphoblastic leukemia (B-cell ALL),CD19 and CD3 targeted,novel; CD19 is novel and mode is novel in directing the human immune system to act against tumor B cells,,,,4FR53SIF3A,,,Monoclonal antibodies(-mab),DNA gyrase subunit A|DNA topoisomerase IV subunit A,,INN|NPC informatics|Structure undefined,US Approved Rx
1,1,1,1,1,,2004,?,chemical,small molecule,33,Ofev,nintedanib,10/15/2014,For the treatment of idiopathic pulmonary fibrosis (IPF),"VEGF, FGFR, and PDGFR inhibitor",perhaps novel use of kinase inhibitor for indication,,,,G6HRD2P839,,,,,ANTINEOPLASTIC AND IMMUNOMODULATING AGENTS,,US Approved Rx
1,1,1,1,1,,?,?,chemical,small molecule,34,Esbriet,pirfenidone,10/15/2014,For the treatment of idiopathic pulmonary fibrosis (IPF),Unknown,novel; systemic antifibrotic activity,,,,D7NLD2JX7U,,,,Vascular endothelial growth factor receptor 1|Vascular endothelial growth factor receptor 2|Vascular endothelial growth factor receptor 3,ANTINEOPLASTIC AND IMMUNOMODULATING AGENTS,,US Approved Rx
1,,1,1,1,,?,?,chemical,small molecule,30,Harvoni,ledipasvir,10/10/2014,To treat chronic hepatitis C virus (HCV) genotype 1 infection,NS5A inhibitor/polymerase inhibitor,Same approach as other anti-HCV therapies,,,,013TE6E4WV,,,Antiviral drug(-vir),,ANTINEOPLASTIC AND IMMUNOMODULATING AGENTS,Approved drugs|ClinicalTrials.gov|EMA orphan|HTS amenable drugs|Human approved drugs|INN|Japan|KEGG|NPC screening|QC spectra,US Approved Rx
,,,,,,2007,?,chemical,small molecule,31,Akynzeo,netupitant,10/10/2014,To treat nausea and vomiting in patients undergoing cancer chemotherapy,NK1 substance P receptor antagonist/5-HT3 receptor antagonist,Similar to aprepitant/setrons,,,,7732P08TIR,,,,Nonstructural protein 5A,ANTIINFECTIVES FOR SYSTEMIC USE,,US Approved Rx
,,,,,,?,?,chemical,small molecule,32,Lumason,sulfur hexafluoride,10/10/2014,For patients whose ultrasound image of the heart (echocardiograms) are hard to see with ultrasound waves,Contrast imaging agent,"Similar to SonoVue, Optison and other contrast agents for ultrasound",,,,WS7LR3I1D6,,,,Substance-P receptor,,HTS amenable drugs|INN|NPC informatics,US Approved Rx
,,,,,,?,?,protein,peptide,29,Trulicity,dulaglutide,9/18/2014,To treat adults with type 2 diabetes.,GLP-1 receptor agonist,"Similar to exenatide, etc.",,,,WTT295HSY5,,,Peptides and glycopeptides(-tide),,VARIOUS,Approved drugs|EMA human approved|FDA NDC|FDA approved|FDA human approved|Human approved drugs|Inorganics|NPC informatics,"US Unapproved, Marketed"
,,,,,,2007,?,chemical,small molecule,28,Movantik,naloxegol,9/16/2014,To treat opioid-induced constipation in adults with chronic non-cancer pain.,Peripherally selective opioid antagonist,Incremental improvement; PEGlated naloxone,,,,44T7335BKE,,,,,ALIMENTARY TRACT AND METABOLISM,,US Approved Rx
1,1,,1,1,1,?,?,protein,antibody,27,Keytruda,pembrolizumab,9/4/2014,For treatment of patients with advanced or unresectable melanoma who are no longer responding to other drugs.,PD-1 inhibitor,Pembrolizumab and Nivolumab are first to target PD-1,,,,DPT0O3T46P,,,Humanized antibody(-zumab)|Monoclonal antibodies(-mab),Mu-type opioid receptor,ALIMENTARY TRACT AND METABOLISM,,US Approved Rx
,1,,,1,,?,?,chemical,small molecule,26,Cerdelga,eliglustat,8/19/2014,For the long-term treatment of adult patients with the Type 1 form of Gaucher disease,Glucosylceramide synthase inhibitor,Similar to miglustat,,,,DR40J4WA67,,,,,ANTINEOPLASTIC AND IMMUNOMODULATING AGENTS,,US Approved Rx
,,,,,,2006,?,protein,PEGlated protein,25,Plegridy,peginterferon beta-1a,8/15/2014,For the treatment of patients with relapsing forms of multiple sclerosis,Unknown,Incremental Improvement; PEGlated interferon beta-1a,,,,I8309403R0,,,,Ceramide glucosyltransferase,ALIMENTARY TRACT AND METABOLISM,,US Approved Rx
1,,,,,,2007,?,chemical,small molecule,24,Belsomra,suvorexant,8/13/2014,To treat difficulty in falling and staying asleep (insomnia),Orexin receptor antagonist,novel; first approved against this target,,,,081L192FO9,,,,,ANTINEOPLASTIC AND IMMUNOMODULATING AGENTS,,US Approved Rx
,,,,1,,?,?,chemical,glycopeptide,23,Orbactiv,oritavancin,8/6/2014,To treat adults with skin infections,Cell membrane disrupter,"Similar to others, a 2nd generation vancomycin",,,,PUG62FRZ2E,,,,Orexin receptor type 1|Orexin receptor type 2,,,US Approved Rx
,,,,,,2008,?,chemical,small molecule,22,Jardiance,empagliflozin,8/1/2014,To improve gylcemic control in adults with type 2 diabetes,SGLT2 inhibitor,Similar to dapagliflozin and canagliflozin,,,,HDC1R2M35U,,,,Enterococcus faecium|Peptidoglycan|Staphylococcus aureus|Streptococcus pyogenes,ANTIINFECTIVES FOR SYSTEMIC USE,Biologics|ClinicalTrials.gov|INN|NPC informatics,US Approved Rx
,,,,,,2006,?,chemical,small molecule,21,Striverdi Respimat,olodaterol,7/31/2014,To treat chronic obstructive pulmonary disease,LABA agonist,"Similar to Salmeterol, Formoterol, Bambuterol",,,,VD2YSN1AFD,,,,Sodium/glucose cotransporter 2,ALIMENTARY TRACT AND METABOLISM,,US Approved Rx
1,1,1,1,1,1,2008,?,chemical,small molecule,20,Zydelig,idelalisib,7/23/2014,"(1) Relapsed chronic lymphocytic leukemia (CLL), in combination with rituximab, in patients for whom rituximab alone would be considered appropriate therapy due to other co-morbidities; and (2) Relapsed small lymphocytic lymphoma (SLL) in patients who have received at least two prior systemic therapies; (3) Relapsed follicular B-cell non-Hodgkin lymphoma (FL) in patients who have received at least two prior systemic therapies.",PI3K delta inhibitor,novel; first approved against this target,,,,YG57I8T5M0,,,,Beta-2 adrenergic receptor,RESPIRATORY SYSTEM,,US Approved Rx
1,,,,,,?,?,chemical,small molecule,19,Kerydin,tavaborole,7/7/2014,For the topical treatment of onychomycosis of the toenails ,tRNA synthetase inhibition,Similar to mupirocin and furanomycin; http://www.sciencedirect.com/science/article/pii/S221132071300016X,,,,K124A4EUQ3,,,,PI3-kinase p110-delta subunit,ANTINEOPLASTIC AND IMMUNOMODULATING AGENTS,,US Approved Rx
,1,1,,1,1,?,?,chemical,small molecule,18,Beleodaq,belinostat,7/3/2014,To treat patients with peripheral T-cell lymphoma (PTCL) ,pan-HDAC inhibitor,Similar to SAHA and other HDACis,,,,F4H96P17NZ,,,,ENTREZ Gene ID: 10373705|ENTREZ Gene ID: 10373871,,,US Approved Rx
,,,,1,,?,?,chemical,small molecule,17,Sivextro,tedizolid phosphate,6/20/2014,To treat adults with skin infections,Bacterial protein synthesis inhibitor,Similar to linezolid and cycloserine,,,,O7DRJ6R4DW,,,,Histone deacetylase 1|Histone deacetylase 3,ANTINEOPLASTIC AND IMMUNOMODULATING AGENTS,,US Approved Rx
,,,,,,?,?,chemical,small molecule,16,Jublia,efinaconazole,6/6/2014,Treat mild to moderate onychomycosis (fungal infection),14α-Demethylase inhibitor,Similar to other azole antifungals,,,,J82SB7FXWB,,,,Bacterial 70S ribosome,,,US Approved Rx
,,1,,1,,?,?,chemical,glycopeptide,15,Dalvance,dalbavancin ,5/23/2014,To treat adults with skin infections,Cell wall synthesis inhibition,"Similar to others, a 2nd generation vancomycin",,,,808UI9MS5K,,,,Lanosterol 14-alpha demethylase,DERMATOLOGICALS,,US Approved Rx
,,1,,1,,1997,?,protein,antibody,14,Entyvio,vedolizumab,5/20/2014,To treat adult patients with moderate to severe ulcerative colitis and adult patients with moderate to severe Crohn‘s disease,Integrin receptor antagonist,novel; targets Integrin α4β7,,,,9RV78Q2002,,,Humanized antibody(-zumab)|Monoclonal antibodies(-mab),Peptidoglycan,ANTIINFECTIVES FOR SYSTEMIC USE,Biologics|INN|NPC informatics,US Approved Rx
1,,1,,,,2004,?,chemical,small molecule,13,Zontivity,vorapaxar,5/8/2014,To reduce the risk of heart attacks and stroke in high-risk patients,PAR-1 antagonist,novel target; PAR-1 antagonist,,,,ZCE93644N2,,,,,ANTINEOPLASTIC AND IMMUNOMODULATING AGENTS,,US Approved Rx
,1,,1,1,1,?,?,chemical,small molecule,12,Zykadia,ceritinib,4/29/2014,To treat patients with anaplastic lymphoma kinase (ALK)-positive metastatic non-small cell lung cancer (NSCLC) who have progressed on or are intolerant to crizotinib,ALK inhibitor,Similar to others; crizotinib seems to have similar kinase profile,,,,K418KG2GET,,,Tyrosine-kinase inhibitors(-tinib),Proteinase-activated receptor 1,BLOOD AND BLOOD FORMING ORGANS,,US Approved Rx
1,1,,,1,,1998,?,protein,antibody,11,Sylvant,siltuximab,4/23/2014,"To treat patients with multicentric Castleman’s disease (MCD), a rare disorder similar to lymphoma (cancer of the lymph nodes)",IL-6 inhibitor,"novel target, but just upstream of Tocilizumab",,,,T4H8FMA7IM,,,Chimeric antibody that responds to more than one antigen(-ximab)|Monoclonal antibodies(-mab),ALK tyrosine kinase receptor,ANTINEOPLASTIC AND IMMUNOMODULATING AGENTS,,US Approved Rx
,1,1,,1,,2005,?,protein,antibody,10,Cyramza,ramucirumab,4/21/2014,To treat patients with advanced stomach cancer or gastroesophageal junction adenocarcinoma,VEGFR2 inhibitor,novel; VEGF and VEGFR1 anitbodies exist,,,,D99YVK4L0X,,,Monoclonal antibodies(-mab),,ANTINEOPLASTIC AND IMMUNOMODULATING AGENTS,,US Approved Rx
,,,,,,?,?,protein,peptide,9,Tanzeum,albiglutide,4/15/2014,"To improve glycemic control, along with diet and exercise, in adults with type 2 diabetes",GLP-1 receptor agonist,"Similar to exenatide, etc.",,,,5E7U48495E,,,Peptides and glycopeptides(-tide),,ANTINEOPLASTIC AND IMMUNOMODULATING AGENTS,,US Approved Rx
1,,,,,,2003,?,chemical,small molecule,8,Otezla,apremilast,3/21/2014,To treat adults with active psoriatic arthritis (PsA),PDE4 inhibitor,novel; no other PDE4 inhibitor seems to have activity in arthritis (Roflumilast is approved for COPD),,,,UP7QBP99PN,,,,,ALIMENTARY TRACT AND METABOLISM,,US Approved Rx
,,,,,,?,?,chemical,small molecule,6,Neuraceq,florbetaben F 18,3/19/2014,For Positron EmissionTomography (PET) imaging of the brain,Radioactive diagnostic,novel; AD plaque imaging,,,,TLA7312TOI,,,,Phosphodiesterase 4,ANTINEOPLASTIC AND IMMUNOMODULATING AGENTS,,Other|US Approved Rx
1,1,1,,1,,?,?,chemical,phospholipid,7,Impavido,miltefosine,3/19/2014,To treat a tropical disease called leishmaniasis,Unknown,novel; various effects incl on AKT,,,,53EY29W7EC,,,Chemical substance(-ine),Amyloid beta A4 protein,VARIOUS,,US Approved Rx
1,1,1,,1,,1999,?,protein,peptide,5,Myalept,metreleptin,2/24/2014,To treat the complications of leptin deficiency,Leptin receptor activation,novel; leptin not previously approved,,,,TL60C27RLH,,,,UNIPROT: B7TYN7,ANTINEOPLASTIC AND IMMUNOMODULATING AGENTS,Approved drugs|ClinicalTrials.gov|EMA orphan|HTS amenable drugs|Human approved drugs|INN|KEGG|NPC screening|QC spectra|Tariff,US Approved Rx
1,1,1,,1,1,?,?,chemical,small molecule,4,Northera,droxidopa,2/18/2014,To treat neurogenic orthostatic hypotension (NOH),Prodrug of norepinephrine and epinephrine,"Incremental improvement, BBB-penetrant prodrug/precursor",,,,J7A92W69L7,,,,,ALIMENTARY TRACT AND METABOLISM,INN|NPC informatics|Structure undefined,US Approved Rx
1,1,1,,1,,?,?,protein,enzyme,3,Vimizim,elosulfase alfa,2/14/2014,Treatment for Mucopolysaccharidosis Type IVA (Morquio A syndrome),Enzyme replacement therapy,novel enzyme replacement therapy,,,,ODJ69JZG85,,,,Adrenergic receptor,CARDIOVASCULAR SYSTEM,Approved drugs|ClinicalTrials.gov|Community curation|DrugBank v3.0|HTS amenable drugs|Human approved drugs|INN|Japan|KEGG|NPC screening,US Approved Rx
,1,,,1,,2006,?,chemical,small molecule,2,Hetlioz,tasimelteon,1/31/2014,To treat non-24- hour sleep-wake disorder (“non-24”) in totally blind individuals. Non-24 is a chronic circadian rhythm (body clock) disorder in the blind that causes problems with the timing of sleep.,Melatonin receptor agonist,"Similar to Melatonin, Ramelteon, Agomelatine",,,,SHS4PU80D9,,,,,ALIMENTARY TRACT AND METABOLISM,,US Approved Rx
,,,,,,2008,?,chemical,small molecule,1,Farxiga,dapagliflozin,1/8/2014,"To improve glycemic control, along with diet and exercise, in adults with type 2 diabetes",SGLT2 inhibitor,"Similar to empagliflozin, canagliflozin, ipragliflozin",,,,1ULL0QJ8UC,,,,Melatonin receptor type 1A|Melatonin receptor type 1B,NERVOUS SYSTEM,Community curation|INN|NPC informatics,US Approved Rx
,,,,,,?,?,chemical,?,27,Anoro Ellipta,umeclidinium,12/18/2013,"For the once-daily, long-term maintenance treatment of airflow obstruction in patients with chronic obstructive pulmonary disease (COPD).",?,?,,,,GE2T1418SV,,,,Sodium/glucose cotransporter 2,ALIMENTARY TRACT AND METABOLISM|DRUGS USED IN DIABETES,INN|NPC informatics,US Approved Rx
1,,1,1,1,,2007,?,chemical,?,26,Sovaldi,sofosbuvir,12/6/2013,To treat chronic hepatitis C virus (HCV) infection.,?,?,,,,WJ6CA3ZU8B,,,Antiviral drug(-vir),Muscarinic acetylcholine receptor M3,RESPIRATORY SYSTEM,,US Approved Rx
,,1,,1,,2007,?,chemical,?,25,Olysio,simeprevir,11/22/2013,To treat chronic hepatitis C virus infection.,?,?,,,,9WS5RD66HZ,,,Antiviral drug(-vir),Acyl coenzyme A:cholesterol acyltransferase|Hepatitis C virus|Lysosomal protective protein,ANTIINFECTIVES FOR SYSTEMIC USE,,US Approved Rx
,,,,,,?,?,chemical,?,24,Luzu,luliconazole,11/14/2013,"For the topical treatment of interdigital tinea pedis, tinea cruris, and tinea corporis caused by the organisms Trichophyton rubrum and Epidermophyton floccosum, in patients 18 years of age and older.",?,?,,,,RE91AN4S8G,,,,Q91RS4_9HEPC,ANTIINFECTIVES FOR SYSTEMIC USE,,US Approved Rx
1,1,1,1,1,1,2009,?,chemical,?,23,Imbruvica,ibrutinib,11/13/2013,"To treat patients with mantle cell lymphoma (MCL), a rare and aggressive type of blood cancer.",?,?,,,,1X70OSD4VX,,,Tyrosine-kinase inhibitors(-tinib),,DERMATOLOGICALS,,Other|US Approved Rx
,,,,,,2000,?,chemical,?,22,Aptiom,eslicarbazepine acetate,11/8/2013,As an add-on medication to treat seizures associated with epilepsy.,?,?,,,,BEA68ZVB2K,,,,Tyrosine-protein kinase BTK,ANTINEOPLASTIC AND IMMUNOMODULATING AGENTS,,US Approved Rx
,1,,1,1,,2008,?,protein,?,21,Gazyva,obinutuzumab,11/1/2013,For use in combination with chlorambucil to treat patients with previously untreated chronic lymphocytic leukemia (CLL).,?,?,,,,O43472U9X8,,,Humanized antibody(-zumab)|Monoclonal antibodies(-mab),Sodium channel alpha subunit,,INN|NPC informatics|Structure undefined,US Approved Rx
,,,,,,?,?,chemical,?,20,Vizamyl,flutemetamol F-18,10/25/2013,A radioactive diagnostic drug for use with positron emission tomography (PET) imaging of the brain in adults being evaluated for Alzheimer's disease (AD) and dementia.,?,?,,,,L49M066S0O,,,,,ANTINEOPLASTIC AND IMMUNOMODULATING AGENTS,,US Approved Rx
,1,,,,,2003,?,chemical,?,19,Opsumit,macitentan,10/18/2013,"To treat adults with pulmonary arterial hypertension (PAH), a chronic, progressive and debilitating disease that can lead to death or the need for lung transplantation.",?,?,,,,Z9K9Y9WMVL,,,,Amyloid beta A4 protein,VARIOUS,,US Approved Rx
1,1,,,1,,2005,?,chemical,?,18,Adempas,riociguat,10/8/2013,To treat adults with two forms of pulmonary hypertension.,?,?,,,,RU3FE2Y4XI,,,,Endothelin B receptor|Endothelin-1 receptor,CARDIOVASCULAR SYSTEM,,US Approved Rx
,,,,,,?,?,chemical,?,17,Duavee,bazedoxifene,10/3/2013,To treat moderate-to-severe hot flashes (vasomotor symptoms) associated with menopause and to prevent osteoporosis after menopause.,?,?,,,,Q16TT9C5BK,,,,Soluble guanylate cyclase,CARDIOVASCULAR SYSTEM,,US Approved Rx
,,,,,,?,?,chemical,?,16,Brintellix,vortioxetine,9/30/2013,To treat adults with major depressive disorder.,?,?,,,,3O2K1S3WQV,,,Antidepressant related to fluoxetine(-oxetine)|Chemical substance(-ine),Estrogen receptor|Estrogen receptor beta,GENITO URINARY SYSTEM AND SEX HORMONES,ClinicalTrials.gov|HTS amenable drugs|KEGG|NPC informatics|NPC screening,US Approved Rx
,,1,,1,,2007,?,chemical,?,15,Tivicay,dolutegravir,8/12/2013,To treat HIV-1 infection.,?,?,,,,DKO1W9H7M1,,,Antiviral drug(-vir),5-hydroxytryptamine receptor 1A|5-hydroxytryptamine receptor 1B|5-hydroxytryptamine receptor 1D|5-hydroxytryptamine receptor 3A|5-hydroxytryptamine receptor 7,NERVOUS SYSTEM,,US Approved Rx
,1,1,,1,,2004,?,chemical,?,14,Gilotrif,afatinib,7/12/2013,"For patients with late stage (metastatic) non-small cell lung cancer (NSCLC) whose tumors express specific types of epidermal growth factor receptor (EGFR) gene mutations, as detected by an FDA-approved test.",?,?,,,,41UD74L59M,,,Tyrosine-kinase inhibitors(-tinib),UNIPROT: Q7ZJM1,ANTIINFECTIVES FOR SYSTEMIC USE,,US Approved Rx
,1,1,,,,?,?,chemical,?,12,Tafinlar,dabrafenib,5/29/2013,To treat patients with melanoma whose tumors express the BRAF V600E gene mutation.,?,?,,,,QGP4HA4G1B,,,,Epidermal growth factor receptor|Receptor tyrosine-protein kinase erbB-2|Receptor tyrosine-protein kinase erbB-4,ANTINEOPLASTIC AND IMMUNOMODULATING AGENTS,,US Approved Rx
