first,orphan,fastTrack,breakthrough,priority,accelerated,initClinicalStudy,therapeuticClass,substanceClass,moleculeType,number,name,ingredients,dateString,use,modeOfAction,innovationCategories,bla,press,trials,unii,pharmacology,target,Inxight INN Stem,Inxight Target,Inxight ATC level 1,Inxight NPC tags,Inxight Dev Status
1,,1,1,1,,?,Infectious disease,chemical,small molecule,38,Viekira Pak,paritaprevir,12/19/2014,"To treat patients with chronic hepatitis C virus (HCV) genotype 1 infection, including those with a type of advanced liver disease called cirrhosis","NS5A, NS3/4A, NS5B polymerase inhibitor",Same approach as other anti-HCV therapies,,,,OU2YM37K86,,,,Antiviral drug(-vir),,ANTIINFECTIVES FOR SYSTEMIC USE,,US Approved Rx
1,,1,1,1,,?,Infectious disease,chemical,small molecule,38,Viekira Pak,dasabuvir,12/19/2014,"To treat patients with chronic hepatitis C virus (HCV) genotype 1 infection, including those with a type of advanced liver disease called cirrhosis","NS5A, NS3/4A, NS5B polymerase inhibitor",Same approach as other anti-HCV therapies,,,,DE54EQW8T1,Inhibitor,polyprotein,"Dasabuvir is a non-nucleoside inhibitor of the hepatitis C virus (HCV) NS5B palm polymerase inhibitor. It is used in the treatment of adult patients with chronic hepatitis C virus infection in combination with ombitasvir, paritaprevir, and ritonavir as the combination product Viekira Pak. Viekira PAK combines three direct-acting antiviral agents with distinct mechanisms of action and non-overlapping resistance profiles to target HCV at multiple steps in the viral lifecycle. Dasabuvir is extensively evaluated in large clinical trials and shown excellent sustained virological response among hepatitis C virus genotype1 patient population in combination with other oral direct acting antivirals, with good safety profile and tolerance.",Antiviral drug(-vir),polyprotein,ANTIINFECTIVES FOR SYSTEMIC USE,,US Approved Rx
,,,,1,,2007,Infectious disease,chemical,small molecule,36,Xtoro,finafloxacin,12/17/2014,"To treat acute otitis externa, commonly known as swimmer’s ear",Topoisomerase and DNA gyrase inhibition,Similar to other fluoroquinolone antibiotics,,,,D26OSN9Q4R,Inhibitor,DNA gyrase subunit A|DNA topoisomerase IV subunit A,"Finafloxacin is a fluoroquinolone antimicrobial agent that exhibits optimum efficacy in slightly acidic environments and is a highly potent eradicator of Helicobacter pylori. Being developed to treat serious bacterial infections associated with an acidic environment, including urinary tract infections and Helicobacter pylori infections finafloxacin is approved for treatment of acute otitis externa (swimmer’s ear) caused by the bacteria Pseudomonas aeruginosa and Staphylococcus aureus. XTORO (finafloxacin otic suspension), 0.3% is supplied as a sterile, preserved, aqueous suspension. Finafloxacin is a drug with a favorable safety profile.",Quinolone-derived antibiotics(-oxacin),DNA gyrase subunit A|DNA topoisomerase IV subunit A,,INN|NPC informatics|Structure undefined,US Approved Rx
1,1,,1,1,1,2002,Hematology,protein,bispecific antibody,35,Blincyto,blinatumomab,12/3/2014,To treat patients with Philadelphia chromosome-negative precursor B-cell acute lymphoblastic leukemia (B-cell ALL),CD19 and CD3 targeted,novel; CD19 is novel and mode is novel in directing the human immune system to act against tumor B cells,,,,4FR53SIF3A,,,,Monoclonal antibodies(-mab),,ANTINEOPLASTIC AND IMMUNOMODULATING AGENTS,,US Approved Rx
1,1,1,1,1,,2004,Respiratory,chemical,small molecule,33,Ofev,nintedanib,10/15/2014,For the treatment of idiopathic pulmonary fibrosis (IPF),"VEGF, FGFR, and PDGFR inhibitor",perhaps novel use of kinase inhibitor for indication,,,,G6HRD2P839,Inhibitor,Vascular endothelial growth factor receptor 1|Vascular endothelial growth factor receptor 2|Vascular endothelial growth factor receptor 3,"Nintedanib is a receptor tyrosine kinase inhibitor with potential antiangiogenic and antineoplastic activities. It is the only kinase inhibitor drug approved to treat idiopathic pulmonary fibrosis. that targets multiple receptor tyrosine kinases (RTKs) and non-receptor tyrosine kinases (nRTKs). Nintedanib inhibits the following RTKs: platelet-derived growth factor receptor (PDGFR) α and β, fibroblast growth factor receptor (FGFR) 1-3, vascular endothelial growth factor receptor (VEGFR) 1-3, and Fms-like tyrosine kinase-3 (FLT3). Among them, FGFR, PDGFR, and VEGFR have been implicated in IPF pathogenesis. Nintedanib binds competitively to the adenosine triphosphate (ATP) binding pocket of these receptors and blocks the intracellular signaling which is crucial for the proliferation, migration, and transformation of fibroblasts representing essential mechanisms of the IPF pathology.",,Vascular endothelial growth factor receptor 1|Vascular endothelial growth factor receptor 2|Vascular endothelial growth factor receptor 3,ANTINEOPLASTIC AND IMMUNOMODULATING AGENTS,,US Approved Rx
1,1,1,1,1,,?,Respiratory,chemical,small molecule,34,Esbriet,pirfenidone,10/15/2014,For the treatment of idiopathic pulmonary fibrosis (IPF),Unknown,novel; systemic antifibrotic activity,,,,D7NLD2JX7U,,,"Pirfenidone is a synthetic antifibrotic agent indicated for the treatment of idiopathic pulmonary fibrosis as Esbriet. Pirfenidone inhibits fibroblast, epidermal, platelet-derived, and transforming beta-1 growth factors. It also inhibits DNA synthesis and the production of mRNA for collagen types I and III, resulting in a reduction in radiation-induced fibrosis. Pirfenidone has demonstrated activity in multiple fibrotic conditions however the exact mechanism of action of pirfenidone in the treatment of IPF has not been established.",,,ANTINEOPLASTIC AND IMMUNOMODULATING AGENTS,Approved drugs|ClinicalTrials.gov|EMA orphan|HTS amenable drugs|Human approved drugs|INN|Japan|KEGG|NPC screening|QC spectra,US Approved Rx
1,,1,1,1,,?,Infectious disease,chemical,small molecule,30,Harvoni,ledipasvir,10/10/2014,To treat chronic hepatitis C virus (HCV) genotype 1 infection,NS5A inhibitor/polymerase inhibitor,Same approach as other anti-HCV therapies,,,,013TE6E4WV,Inhibitor,Nonstructural protein 5A,"Ledipasvir is an inhibitor of the Hepatitis C Virus (HCV) NS5A protein required for viral RNA replication and assembly of HCV virions. Approved in October 2014 by the FDA, ledipasvir and sofosbuvir (tradename Harvoni) are direct-acting antiviral agents indicated for the treatment of HCV genotype 1 with or without cirrhosis.",Antiviral drug(-vir),Nonstructural protein 5A,ANTIINFECTIVES FOR SYSTEMIC USE,,US Approved Rx
,,,,,,2007,Oncology,chemical,small molecule,31,Akynzeo,netupitant,10/10/2014,To treat nausea and vomiting in patients undergoing cancer chemotherapy,NK1 substance P receptor antagonist/5-HT3 receptor antagonist,Similar to aprepitant/setrons,,,,7732P08TIR,Antagonist,Substance-P receptor,Netupitant is an antiemitic drug approved by the FDA in October 2014 for use in combination with palonosetron for the prevention of acute and delayed vomiting and nausea associated with cancer chemotherapy including highly emetogenic chemotherapy.,,Substance-P receptor,,HTS amenable drugs|INN|NPC informatics,US Approved Rx
,,,,,,?,Cardiology,chemical,small molecule,32,Lumason,sulfur hexafluoride,10/10/2014,For patients whose ultrasound image of the heart (echocardiograms) are hard to see with ultrasound waves,Contrast imaging agent,"Similar to SonoVue, Optison and other contrast agents for ultrasound",,,,WS7LR3I1D6,,,,,,VARIOUS,Approved drugs|EMA human approved|FDA NDC|FDA approved|FDA human approved|Human approved drugs|Inorganics|NPC informatics,"US Unapproved, Marketed"
,,,,,,?,Endocrinology,protein,peptide,29,Trulicity,dulaglutide,9/18/2014,To treat adults with type 2 diabetes.,GLP-1 receptor agonist,"Similar to exenatide, etc.",,,,WTT295HSY5,,,,Peptides and glycopeptides(-tide),,ALIMENTARY TRACT AND METABOLISM,,US Approved Rx
,,,,,,2007,Oncology,chemical,small molecule,28,Movantik,naloxegol,9/16/2014,To treat opioid-induced constipation in adults with chronic non-cancer pain.,Peripherally selective opioid antagonist,Incremental improvement; PEGlated naloxone,,,,44T7335BKE,Antagonist,Mu-type opioid receptor,MOVANTIK (naloxegol) is a peripherally-acting mu-opioid receptor antagonist indicated for the treatment of opioid-induced constipation (OIC) in adult patients with chronic noncancer pain. It is being investigated for the treatment of constipation as a side effect of prescription opioid pain medicines.,,Mu-type opioid receptor,ALIMENTARY TRACT AND METABOLISM,,US Approved Rx
1,1,,1,1,1,?,Oncology,protein,antibody,27,Keytruda,pembrolizumab,9/4/2014,For treatment of patients with advanced or unresectable melanoma who are no longer responding to other drugs.,PD-1 inhibitor,Pembrolizumab and Nivolumab are first to target PD-1,,,,DPT0O3T46P,,,,Humanized antibody(-zumab)|Monoclonal antibodies(-mab),,ANTINEOPLASTIC AND IMMUNOMODULATING AGENTS,,US Approved Rx
,1,,,1,,?,Endocrinology,chemical,small molecule,26,Cerdelga,eliglustat,8/19/2014,For the long-term treatment of adult patients with the Type 1 form of Gaucher disease,Glucosylceramide synthase inhibitor,Similar to miglustat,,,,DR40J4WA67,Antagonist,Ceramide glucosyltransferase,"Eliglustat, marketed by Genzyme as CERDELGA, is a glucosylceramide synthase inhibitor indicated for the long-term treatment of type 1 Gaucher disease who are CYP2D6 extensive metabolizers, intermediate metabolizers, or poor metabolizers (PMs) as detected by an FDA-cleared test.",,Ceramide glucosyltransferase,ALIMENTARY TRACT AND METABOLISM,,US Approved Rx
,,,,,,2006,Neurology,protein,PEGlated protein,25,Plegridy,peginterferon beta-1a,8/15/2014,For the treatment of patients with relapsing forms of multiple sclerosis,Unknown,Incremental Improvement; PEGlated interferon beta-1a,,,,I8309403R0,,,,,,ANTINEOPLASTIC AND IMMUNOMODULATING AGENTS,,US Approved Rx
1,,,,,,2007,Neurology,chemical,small molecule,24,Belsomra,suvorexant,8/13/2014,To treat difficulty in falling and staying asleep (insomnia),Orexin receptor antagonist,novel; first approved against this target,,,,081L192FO9,Antagonist,Orexin receptor type 1|Orexin receptor type 2,Suvorexant is a selective dual antagonist of orexin receptors OX1R and OX2R. It has been approved for the treatment of insomnia. The mechanism by which suvorexant exerts its therapeutic effect in insomnia is presumed to be through antagonism of orexin receptors. The orexin neuropeptide signaling system is a central promoter of wakefulness. Blocking the binding of wake-promoting neuropeptides orexin A and orexin B to receptors OX1R and OX2R is thought to suppress wake drive.,,Orexin receptor type 1|Orexin receptor type 2,,,US Approved Rx
,,,,1,,?,Infectious disease,chemical,glycopeptide,23,Orbactiv,oritavancin,8/6/2014,To treat adults with skin infections,Cell membrane disrupter,"Similar to others, a 2nd generation vancomycin",,,,PUG62FRZ2E,Inhibitor,Enterococcus faecium|Peptidoglycan|Staphylococcus aureus|Streptococcus pyogenes,"Oritavancin is an glycopeptide antibiotic with bactericidal activity effective in treating infections caused by Gram-positive organisms. It treats complicated skin and skin structure infections. This drug demonstrates similar activity to vancomycin, but it has stronger activity against Staphylococcus and Enterococcus. The pharmacokinetics and pharmacodynamics of oritavancin appear to be favourable and once-daily dosing is likely. The incidence of multi-drug resistant bacteria is increasing and explorations into additional treatment options are essential. Oritavancin is marketed under the brand name Orbactiv. Orbactiv is indicated for the treatment of adult patients with acute bacterial skin and skin structure infections caused or suspected to be caused by susceptible isolates of designated Gram-positive microorganisms. Oritavancin has the following mechanism of action: 1) Inhibition of the transglycosylation (polymerisation) step of cell wall biosynthesis by binding to the stem peptide of peptidoglycan precursors 2) Inhibition of the transpeptidation (crosslinking) step of cell wall biosynthesis by binding to the peptide bridging segments of the cell wall 3) Disruption of bacterial membrane integrity, leading to depolarisation, increased permeability and rapid cell death.",,Enterococcus faecium|Peptidoglycan|Staphylococcus aureus|Streptococcus pyogenes,ANTIINFECTIVES FOR SYSTEMIC USE,Biologics|ClinicalTrials.gov|INN|NPC informatics,US Approved Rx
,,,,,,2008,Endocrinology,chemical,small molecule,22,Jardiance,empagliflozin,8/1/2014,To improve gylcemic control in adults with type 2 diabetes,SGLT2 inhibitor,Similar to dapagliflozin and canagliflozin,,,,HDC1R2M35U,Antagonist,Sodium/glucose cotransporter 2,"Empagliflozin is a selective sodium glucose cotransporter-2 (SGLT-2) inhibitor designed for the treatment of type 2 diabetes mellitus. By inhibiting SGLT2, empagliflozin reduces renal reabsorption of filtered glucose and lowers the renal threshold for glucose, and thereby increases urinary glucose excretion. Empagliflozin interacts with diuretics, blood presure medicine and insulin. Jardiance reduces the risk of cardiovascular death in diabetes patients at high cardiovascular risk.",,Sodium/glucose cotransporter 2,ALIMENTARY TRACT AND METABOLISM,,US Approved Rx
,,,,,,2006,Respiratory,chemical,small molecule,21,Striverdi Respimat,olodaterol,7/31/2014,To treat chronic obstructive pulmonary disease,LABA agonist,"Similar to Salmeterol, Formoterol, Bambuterol",,,,VD2YSN1AFD,Agonist,Beta-2 adrenergic receptor,"Olodaterol is a beta2-adrenoceptor agonist discovered by Boehringer Ingelheim and approved for the treatment of Chronic Obstructive Pulmonary Disease. The compound exerts its pharmacological effects by binding and activation of beta2-adrenoceptors after inhalation. Activation of these receptors in the airways results in a stimulation of intracellular adenyl cyclase, an enzyme that mediates the synthesis of cyclic-3’, 5’ adenosine monophosphate (cAMP). Elevated levels of cAMP induce bronchodilation by relaxation of airway smooth muscle cells. Olodaterol effect lasts for 24 hours.",,Beta-2 adrenergic receptor,RESPIRATORY SYSTEM,,US Approved Rx
1,1,1,1,1,1,2008,Hematology,chemical,small molecule,20,Zydelig,idelalisib,7/23/2014,"(1) Relapsed chronic lymphocytic leukemia (CLL), in combination with rituximab, in patients for whom rituximab alone would be considered appropriate therapy due to other co-morbidities; and (2) Relapsed small lymphocytic lymphoma (SLL) in patients who have received at least two prior systemic therapies; (3) Relapsed follicular B-cell non-Hodgkin lymphoma (FL) in patients who have received at least two prior systemic therapies.",PI3K delta inhibitor,novel; first approved against this target,,,,YG57I8T5M0,Antagonist,PI3-kinase p110-delta subunit,"Idelalisib is a first-in-class selective inhibitor of adenosine-5'-triphosphate (ATP) binding to PI3Kdelta kinase, resulting in inhibition of the P13K signalling pathway in malignant B cells. The compound is approved for the treatment of several types of blood cancer. Idelalisib is intended to be used in combination with rituximab as second or subsequent line therapy for the treatment of chronic lymphocytic leukaemia. The drug may cause fatal and/or severe diarrhea or colitis, hepatotoxicity, pneumonitis and intestinal perforation.",,PI3-kinase p110-delta subunit,ANTINEOPLASTIC AND IMMUNOMODULATING AGENTS,,US Approved Rx
1,,,,,,?,Infectious disease,chemical,small molecule,19,Kerydin,tavaborole,7/7/2014,For the topical treatment of onychomycosis of the toenails ,tRNA synthetase inhibition,Similar to mupirocin and furanomycin; http://www.sciencedirect.com/science/article/pii/S221132071300016X,,,,K124A4EUQ3,Antagonist,ENTREZ Gene ID: 10373705|ENTREZ Gene ID: 10373871,"Tavaborole is a boron-based pharmaceutical agent indicated for the topical treatment of toenail onychomycosis, a fungal infection of the nail and nail bed due to Trichophyton rubrum or Trichophyton mentagrophytes infection. Tavaborole acts by inhibiting an aminoacyl-transfer ribonucleic acid (tRNA) synthetase (AARS) - Leucyl-tRNA synthetase. Leucyl-tRNA synthetase is an essential fungal enzyme required for protein synthesis and for the catalysis of ATP-dependent ligation of L-leucine to tRNA(Leu). Tavaborole’s low molecular weight (approximately half of most antifungals, such as terbinafine and efinaconazole) permits optimal nail plate penetration, superior to that of existing topical antifungal medications.",,ENTREZ Gene ID: 10373705|ENTREZ Gene ID: 10373871,,,US Approved Rx
,1,1,,1,1,?,Hematology,chemical,small molecule,18,Beleodaq,belinostat,7/3/2014,To treat patients with peripheral T-cell lymphoma (PTCL) ,pan-HDAC inhibitor,Similar to SAHA and other HDACis,,,,F4H96P17NZ,Inhibitor,Histone deacetylase 1|Histone deacetylase 3,"Belinostat is a hydroxamate-type histone deacetylase inhibitor indicated for the treatment of relapsed or refractory peripheal T-cell lymphoma. The compound received orphan drug designation for the treatment of malignant thymomas. Acting on a histone deacetylase Belinostat causes the accumulation of acetylated histones and other proteins, inducing cell cycle arrest and/or apoptosis of some transformed cells. Belinostat targets HDAC enzymes, thereby inhibiting tumor cell proliferation, inducing apoptosis, promoting cellular differentiation, and inhibiting angiogenesis. This agent may sensitize drug-resistant tumor cells to other antineoplastic agents, possibly through a mechanism involving the down-regulation of thymidylate synthase. PXD101 has been shown in preclinical studies to have the potential to treat a wide range of solid and hematologic malignancies either as a monotherapy or in combination with other active agents, and both an oral and intravenous formulation of the drug are being evaluated in clinical trials.",,Histone deacetylase 1|Histone deacetylase 3,ANTINEOPLASTIC AND IMMUNOMODULATING AGENTS,,US Approved Rx
,,,,1,,?,Infectious disease,chemical,small molecule,17,Sivextro,tedizolid phosphate,6/20/2014,To treat adults with skin infections,Bacterial protein synthesis inhibitor,Similar to linezolid and cycloserine,,,,O7DRJ6R4DW,Antagonist|Inhibitor,Bacterial 70S ribosome,"Tedizolid phosphate is an oxazolidinone prodrug which in the body is dephosphorylated to the active compound tedizolid. The antibacterial activity of tedizolid is mediated by binding to the 50S subunit of the bacterial ribosome resulting in inhibition of protein synthesis. Tedizolid inhibits bacterial protein synthesis through a mechanism of action different from that of other non-oxazolidinone class antibacterial drugs; therefore, cross-resistance between tedizolid and other classes of antibacterial drugs is unlikely. Tedizolid is bacteriostatic against Gram Positive bacteria such as enterococci, staphylococci, and streptococci. No drug-drug interactions were identified with tedizolid.|Tedizolid (also known as TR-700, DA-7157) as is an active compound, which is produced by plasma or intestinal phosphatases, after administration of the drug, tedizolid phosphate either orally or intravenously. The mechanism of action of tedizolid occurs through inhibition of bacterial protein synthesis by binding to the 23S ribosomal RNA of the 50S subunit, thereby preventing the formation of the 70S initiation complex and inhibiting protein synthesis.",,Bacterial 70S ribosome,,,US Approved Rx
,,,,,,?,Infectious disease,chemical,small molecule,16,Jublia,efinaconazole,6/6/2014,Treat mild to moderate onychomycosis (fungal infection),14α-Demethylase inhibitor,Similar to other azole antifungals,,,,J82SB7FXWB,Inhibitor,Lanosterol 14-alpha demethylase,"Efinaconazole is triazole used as a 10% topical solution for the treatment of onychomycosis, a fungal infection of the nails. It was approved for use in Canada and the USA in 2014 and is marketed by Valeant Pharmaceuticals North America LLC under the name Jublia. Like other antifungal triazoles, efinaconazole inhibits the fungal cytochrome P450 enzyme lanosterol 14α demethylase (CYP51), thereby disrupting ergosterol synthesis and, consequently, membrane integrity and growth in fungi. CYP51 is evolutionarily conserved and, in mammals, mediates conversion of lanosterol to meiosis-activating sterols (MAS); MAS are intermediates in the biosynthesis of cholesterol and may have a signaling role in initiating meiosis and oocyte maturation. Azoles have higher affinity for fungal CYP51 compared to the mammalian enzyme and such selectivity contributes to the safety of this therapeutic class. Azoles have been reported to produce reproductive and developmental toxicity in both humans and laboratory animals. The mechanism is unknown but inhibition of mammalian CYP51 as well as other CYPs, e.g. CYP17, CYP19 and CYP26, have been postulated to play a role.",,Lanosterol 14-alpha demethylase,DERMATOLOGICALS,,US Approved Rx
,,1,,1,,?,Infectious disease,chemical,glycopeptide,15,Dalvance,dalbavancin ,5/23/2014,To treat adults with skin infections,Cell wall synthesis inhibition,"Similar to others, a 2nd generation vancomycin",,,,808UI9MS5K,Inhibitor,Peptidoglycan,"Dalbavancin is a second-generation lipoglycopeptide antibiotic that was designed to improve on the natural glycopeptides currently available, such as vancomycin and teicoplanin. Modifications from these older glycoprotein classes allowed a similar mechanism of action with increased activity and once weekly dosing. Its use is indicated for the treatment of acute bacterial skin and skin structure infections (ABSSSI) caused by the following gram-positive microorganisms: Staphylococcus aureus (including methicillin-susceptible and methicillin-resistant strains), S. pyogenes, S. agalactiae, and S. anginosus group (including S. anginosus, S. intermedius, and S. constellatus). Under the brand name DALVANCE Dalbavancin is indicated for acute bacterial skin and skin structure infections (ABSSSI) caused by designated susceptible strains of Gram-positive microorganisms. The bactericidal action of dalbavancin results primarily from inhibition of cell-wall biosynthesis. Specifically, dalbavancin prevents incorporation of N-acetylmuramic acid (NAM)- and N-acetylglucosamine (NAG)-peptide subunits from being incorporated into the peptidoglycan matrix; which forms the major structural component of Gram-positive cell walls. The large hydrophilic molecule is able to form hydrogen bond interactions with the terminal D-alanyl-D-alanine moieties of the NAM/NAG-peptides, which is normally a five-point interaction. Binding of dalbavancin to the D-Ala-D-Ala prevents the incorporation of the NAM/NAG-peptide subunits into the peptidoglycan matrix. In addition, dalbavancin alters bacterial-cell-membrane permeability and RNA synthesis.",,Peptidoglycan,ANTIINFECTIVES FOR SYSTEMIC USE,Biologics|INN|NPC informatics,US Approved Rx
,,1,,1,,1997,Gastroenterology,protein,antibody,14,Entyvio,vedolizumab,5/20/2014,To treat adult patients with moderate to severe ulcerative colitis and adult patients with moderate to severe Crohn‘s disease,Integrin receptor antagonist,novel; targets Integrin α4β7,,,,9RV78Q2002,,,,Humanized antibody(-zumab)|Monoclonal antibodies(-mab),,ANTINEOPLASTIC AND IMMUNOMODULATING AGENTS,,US Approved Rx
1,,1,,,,2004,Cardiology,chemical,small molecule,13,Zontivity,vorapaxar,5/8/2014,To reduce the risk of heart attacks and stroke in high-risk patients,PAR-1 antagonist,novel target; PAR-1 antagonist,,,,ZCE93644N2,Antagonist,Proteinase-activated receptor 1,"Vorapaxar is a tricyclic himbacine-derived oral thrombin receptor antagonist that acts by reversible inhibition of the protease-activated receptor-1 (PAR-1). PAR-1 is expressed on platelets and its inhibition prevents platelets from aggregation. Vorapaxar is approved by FDA and is indicated for the reduction of recurring thrombotic cardiovascular events in patients with a history of myocardial infarction or with peripheral arterial disease. Vorapaxar at the same time may cause bleeding complications including intracranial haemorrhage (ICH), when compared to standard therapy alone. That is why Vorapaxar is contraindicated in patients with prior stroke, transient ischemic attack and ICH.",,Proteinase-activated receptor 1,BLOOD AND BLOOD FORMING ORGANS,,US Approved Rx
,1,,1,1,1,?,Hematology,chemical,small molecule,12,Zykadia,ceritinib,4/29/2014,To treat patients with anaplastic lymphoma kinase (ALK)-positive metastatic non-small cell lung cancer (NSCLC) who have progressed on or are intolerant to crizotinib,ALK inhibitor,Similar to others; crizotinib seems to have similar kinase profile,,,,K418KG2GET,Antagonist,ALK tyrosine kinase receptor,"Ceritinib is a selective inhibitor of ALK1, a target found in metastatic non-small cell lung cancer (NSCLC). Ceritinib is approved by FDA and is indicated for the treatment of anaplastic lymphoma kinase (ALK)-positive metastatic non-small cell lung cancer. Ceritinib also targets insulin-like growth factor 1 receptor (IGF-1R), insulin receptor (InsR), and ROS1.",Tyrosine-kinase inhibitors(-tinib),ALK tyrosine kinase receptor,ANTINEOPLASTIC AND IMMUNOMODULATING AGENTS,,US Approved Rx
1,1,,,1,,1998,Hematology,protein,antibody,11,Sylvant,siltuximab,4/23/2014,"To treat patients with multicentric Castleman’s disease (MCD), a rare disorder similar to lymphoma (cancer of the lymph nodes)",IL-6 inhibitor,"novel target, but just upstream of Tocilizumab",,,,T4H8FMA7IM,,,,Chimeric antibody that responds to more than one antigen(-ximab)|Monoclonal antibodies(-mab),,ANTINEOPLASTIC AND IMMUNOMODULATING AGENTS,,US Approved Rx
