first,orphan,fastTrack,breakthrough,priority,accelerated,initClinicalStudy,therapeuticClass,substanceClass,moleculeType,number,name,ingredients,dateString,use,modeOfAction,innovationCategories,bla,press,trials,unii,pharmacology,target,Inxight INN Stem,Inxight Target,Inxight ATC level 1,Inxight NPC tags,Inxight Dev Status
,1,1,,,,?,Oncology,chemical,small molecule,12,Tafinlar,dabrafenib,5/29/2013,To treat patients with melanoma whose tumors express the BRAF V600E gene mutation.,?,?,,,,QGP4HA4G1B,Inhibitor,Serine/threonine-protein kinase B-raf,"Dabrafenib is a selective, orally bioavailable inhibitor of Mutant BRAF protein kinase with potential antineoplastic activity. Dabrafenib inhibits BRAF kinases with in vitro IC50 values of 0.65, 0.5, and 1.84 nM for BRAF V600E, BRAF V600K, and BRAF V600D enzymes, respectively. Dabrafenib also inhibits wild-type BRAF and CRAF kinases with IC50 values of 3.2 and 5.0 nM. BRAF belongs to the the raf/mil family of serine/threonine protein kinases and plays a role in regulating the MAP kinase/ERKs signaling pathway, which may be constitutively activated due to BRAF gene mutations. Mutations in BRAF are associated with increased growth and proliferation of cancer cells. By inhibiting BRAF kinase dabrafenib negatively regulates the proliferation of tumor cells which contain a mutated BRAF gene. Dabrafenib (in combination with trametinib or alone) is indicated for the treatment of unresectable or metastatic melanoma with BRAF V600E mutation",,Serine/threonine-protein kinase B-raf,ANTINEOPLASTIC AND IMMUNOMODULATING AGENTS,,US Approved Rx
1,1,1,,,,2008,Oncology,chemical,small molecule,13,Mekinist,trametinib,5/29/2013,To treat patients whose tumors express the BRAF V600E or V600K gene mutations.,?,?,,,,33E86K87QN,Antagonist,Dual specificity mitogen-activated protein kinase kinase 1|Dual specificity mitogen-activated protein kinase kinase 2,"Trametinib is a reversible and specific inhibitor of mitogen-activated protein kinase kinases MEK1 and MEK2 which are involved in a RAS/RAF/MEK/ERK signaling pathway and control cell growth, survival, and differentiation. By inhibiting MEK1 and MEK2 trametinib blocks dual phosphorylation of ERK1/2 and stops cell cycling. In addition, trametinib blocks BRAF pathway in the cells with BRAF V600E mutations. Trametinib (as a single agent and in combination with dabrafenib) is approved for the treatment of unresectable or metastatic melanoma with BRAF V600E or V600K mutations.",Tyrosine-kinase inhibitors(-tinib),Dual specificity mitogen-activated protein kinase kinase 1|Dual specificity mitogen-activated protein kinase kinase 2,ANTINEOPLASTIC AND IMMUNOMODULATING AGENTS,,US Approved Rx
1,,1,,1,,?,Oncology,chemical,small molecule,11,Xofigo,radium Ra 223 dichloride,5/15/2013,To treat men with symptomatic late-stage (metastatic) castration-resistant prostate cancer that has spread to bones but not to other organs.,?,?,,,,RJ00KV3VTG,,,Radium Ra 223 dichloride is a radiotherapeutic drug that is approved for the treatment of male patients with symptoms of advanced prostate cancer with bone metastases. Ra 223 mimics calcium and forms complexes with the bone mineral hydroxyapatite at areas of increased bone turnover. The radioactive alpha particles emitted by radium Ra 223 helps in killing cancer cells in the bone by damaging their DNA. Radium Ra 223 causes minimal damage to the nearby healthy cells.,,,,,US Approved Rx
,,,,,,?,Respiratory,chemical,small molecule,10,Breo Ellipta,vilanterol,5/10/2013,"For the long-term, once-daily, maintenance treatment of airflow obstruction in patients with chronic obstructive pulmonary disease (COPD), including chronic bronchitis and/or emphysema.",?,?,,,,028LZY775B,Agonist,"adrenoceptor beta 2, surface","Vilanterol (INN, USAN) is an ultra-long-acting β2 adrenoreceptor agonist (ultra-LABA), which was approved in May 2013 in combination with fluticasone furoate for sale as Breo Ellipta by GlaxoSmithKline for the treatment of chronic obstructive pulmonary disease (COPD). Its pharmacological effect is attributable to stimulation of intracellular adenylyl cyclase which catalyzes the conversion of adenosine triphosphate (ATP) to cyclic-3’,5’-adenosine monophosphate (cAMP). Increases in cyclic AMP are associated with relaxation of bronchial smooth muscle and inhibition of release of hypersensitivity mediators from mast cells in the lungs. Vilanterol is available in following combinations: a) with inhaled corticosteroid fluticasone furoate — fluticasone furoate/vilanterol (trade names Breo Ellipta , Relvar Ellipta; b) with muscarinic antagonist umeclidinium bromide — umeclidinium bromide/vilanterol (trade name Anoro Ellipta).",,"adrenoceptor beta 2, surface",RESPIRATORY SYSTEM,,US Approved Rx
1,,,,,,2006,Endocrinology,chemical,small molecule,9,Invokana,canagliflozin,3/29/2013,"Used with diet and exercise, to improve glycemic control in adults with type 2 diabetes.",?,?,,,,0SAC974Z85,Inhibitor,Sodium/glucose cotransporter 2,"Canagliflozin (INN, trade name Invokana or Sulisent) is a drug of the gliflozin class. It was developed by Mitsubishi Tanabe Pharma and is marketed under license by Janssen, a division of Johnson & Johnson. Canagliflozin is an antidiabetic drug used to improve glycemic control in people with type 2 diabetes. Sodium-glucose co-transporter 2 (SGLT2), expressed in the proximal renal tubules, is responsible for the majority of the reabsorption of filtered glucose from the tubular lumen. Canagliflozin is an inhibitor of SGLT2. By inhibiting SGLT2, canagliflozin reduces reabsorption of filtered glucose and lowers the renal threshold for glucose (RTG), and thereby increases urinary glucose excretion. In extensive clinical trials, canagliflozin produced a consistent dose-dependent reduction in HbA1c of 0.77% to 1.16% when administered as monotherapy, combination with metformin, combination with metformin and a sulfonylurea, combination with metformin and pioglitazone, and in combination with insulin from a baselines of 7.8% to 8.1%, in combination with metformin, or in combination with metformin and a sulfonylurea. When added to metformin, canagliflozin 100 mg was shown to be non-inferior to both sitagliptin 100 mg and glimepiride in reductions on HbA1c at one year, whilst canagliflozin 300 mg successfully demonstrated statistical superiority over both sitagliptin and glimiperide in HbA1c reductions. Secondary efficacy endpoint of superior body weight reduction and blood pressure reduction (versus sitagliptin and glimiperide)) were observed as well. Canagliflozin produces beneficial effects on HDL cholesterol whilst increasing LDL cholesterol to produce no change in total cholesterol.",,Sodium/glucose cotransporter 2,ALIMENTARY TRACT AND METABOLISM,,US Approved Rx
1,,,,,,1999,Neurology,chemical,small molecule,8,Tecfidera,dimethyl fumarate,3/27/2013,To treat adults with relapsing forms of multiple sclerosis (MS).,?,?,,,,FO2303MNI2,,,,,,NERVOUS SYSTEM,,US Approved Rx
,,,,1,,?,Neurology,chemical,small molecule,7,Dotarem,gadoterate meglumine,3/20/2013,"For use in magnetic resonance imaging (MRI) of the brain, spine and associated tissues of patients ages 2 years and older.",?,?,,,,L0ND3981AG,,,"DOTAREM (Gadoterate Meglumine ) is a gadolinium-based contrast agent indicated for intravenous use with magnetic resonance imaging (MRI) in brain (intracranial), spine and associatedtissues in adult and pediatric patients (2 years of age and older) to detect and visualize areas with disruption of the blood brain barrier (BBB) and/or abnormal vascularity. Gadoterate Meglumine is a gadolinium chelate paramagnetic contrast agent. When placed in a magnetic field, gadoterate meglumine produces a large magnetic moment and so a large local magnetic field, which can enhance the relaxation rate of nearby protons; as a result, the signal intensity of tissue images observed with magnetic resonance imaging (MRI) may be enhanced. Because this agent is preferentially taken up by normal functioning hepatocytes, normal hepatic tissue is enhanced with MRI while tumor tissue is unenhanced. In addition, because gadobenate dimeglumine is excreted in the bile, it may be used to visualize the biliary system using MRI.|Gadobutrol is a second-generation extracellular non-ionic macrocyclic GBCA that is used in patients undergoing diagnostic contrast-enhanced MRI for visualization of pathological lesions in the CNS and all other body regions or for contrast-enhanced magnetic resonance angiography (MRA) to evaluate perfusion and flow-related abnormalities. It is a non-ionic, paramagnetic complex consisting of gadolinium (Gd3+) chelated with the macrocyclic compound dihydroxy-hydroxymethylpropyl-tetraazacyclododecane-triacetic acid (butrol). Gadavist (the trade name of gadobutrol) was approved by FDA in 2011 for intravenous use in diagnostic MRI in adults and children (2 years of age and older) to detect and visualize areas with disrupted blood brain barrier and/or abnormal vascularity of the central nervous system. Application of gadobutrol in humans, up to a dose of 0.5 mmol/kg was shown to be well tolerated. Following intravenous administration, gadobutrol may increase MRI sensitivity for the detection of tumors and inflammatory and demyelinating diseases of the central nervous system which are associated with areas with blood-brain barrier defects due to altered perfusion or an enlarged extracellular space. Gadobutrol is not metabolized. It is eliminated in an unchanged form via the kidneys; extra-renal elimination is negligible. Side effects include headache, nausea, abnormal taste and feeling hot.",Chemical substance(-ine),,,ClinicalTrials.gov|Community curation|DrugBank v3.0|EMA human approved|FDA DailyMed|FDA orange book|Human approved drugs|Inorganics|Japan|Structure undefined,US Approved Rx
,,,,,,?,Oncology,polymer,polydisperse oligonucleotide,6,Lymphoseek,technetium Tc 99m tilmanocept,3/13/2013,A radioactive diagnostic imaging agent that helps doctors locate lymph nodes in patients with breast cancer or melanoma who are undergoing surgery to remove tumor-draining lymph nodes.,?,?,,,,8IHI69PQTC,Binding Agent,Macrophage mannose receptor 1,"Technetium (99mTc) tilmanocept, trade name Lymphoseek, is a radiopharmaceutical diagnostic imaging agent approved for the imaging of lymph nodes. It is used to locate those lymph nodes which may be draining from tumors, and assist doctors in locating those lymph nodes for removal during surgery.",,Macrophage mannose receptor 1,VARIOUS,,US Approved Rx
,,,,,,2001,Neurology,chemical,small molecule,5,Osphena,ospemifene,2/26/2013,"To treat women experiencing moderate to severe dyspareunia (pain during sexual intercourse), a symptom of vulvar and vaginal atrophy due to menopause.",?,?,,,,B0P231ILBK,Modulator,Estrogen receptor|Estrogen receptor beta,"Ospemifene (commercial name Osphena produced by Shionogi) is anoral medication indicated for the treatment of dyspareunia – pain during sexual intercourse – encountered by some women, more often in those who are post-menopausal. Ospemifene is a selective estrogen receptor modulator (SERM) that selectively binds to estrogen receptors and either stimulates or blocks estrogen's activity in different tissue types. It has an agonistic effect on the endometrium. It’s building vaginal wall thickness which in turn reduces the pain associated with dyspareunia. Dyspareunia is most commonly caused by ""vulval and vaginal atrophy”.",,Estrogen receptor|Estrogen receptor beta,GENITO URINARY SYSTEM AND SEX HORMONES,Community curation|HTS amenable drugs|INN|NPC informatics,US Approved Rx
1,,1,,1,,2006,Oncology,protein,antibody,4,Kadcyla,ado-trastuzumab emtansine,2/22/2013,"For patients with HER2-positive, late-stage (metastatic) breast cancer.",?,?,,,,SE2KH7T06F,Blocker,Receptor tyrosine-protein kinase erbB-2,"Trastuzumab emtansine (ado-trastuzumab emtansine, trade name Kadcyla) is a combination between a monoclonal antibody and a small-molecule drug. Each molecule of trastuzumab emtansine consists of a single trastuzumab molecule with several molecules of DM1, a cytotoxic maytansinoid, attached. SMCC, or succinimidyl trans-4-(maleimidylmethyl)cyclohexane-1-carboxylate, is a heterobifunctional crosslinker, a type of chemical reagent that contains two reactive functional groups, a succinimide ester and a maleimide. The succinimide group of SMCC reacts with the free amino group of a lysine residue in the trastuzumab molecule and the maleimide moiety of SMCC links to the free sulfhydryl group of DM1, forming a covalent bond between the antibody and the DM1. Each trastuzumab molecule may be linked to zero to eight DM1 molecules (3.5 on average). Trastuzumab emtansine is an antibody-drug conjugate consisting of the recombinant anti-epidermal growth factor receptor 2 (HER2) monoclonal antibody trastuzumab conjugated to the maytansinoid DM1. The trastuzumab moiety of this ADC binds to HER2 on tumor cell surface surfaces; upon internalization, the DM1 moiety is released and binds to tubulin, thereby disrupting microtubule assembly/disassembly dynamics and inhibiting cell division and the proliferation of cancer cells that overexpress HER2. Linkage of antibody and drug through a nonreducible linker has been reported to contribute to the improved efficacy and reduced toxicity of this ADC compared to similar ADCs constructed with reducible linkers. Trastuzumab emtansine is used for the treatment of patients with HER2-positive, metastatic breast cancer who previously received rastuzumab and a taxane, separately or in combination. Patients should have either: received prior therapy for metastatic disease, or developed disease recurrence during or within six months of completing adjuvant therapy. Ado-trastuzumab emtansine is marketed under the brand name Kadcyla and is indicated for use in HER2-positive, metastatic breast cancer patients who have already used taxane and/or trastuzumab for metastatic disease or had their cancer recur within 6 months of adjuvant treatment. The FDA label has two precautions. First that ado-trastuzumab emtansine and trastuzumab cannot be interchanged. Second that there is a black box warning of serious side effects such as hepatotoxicity, embryo-fetal toxicity, and cardiac toxicity.",Chemical substance(-ine),Receptor tyrosine-protein kinase erbB-2,ANTINEOPLASTIC AND IMMUNOMODULATING AGENTS,,US Approved Rx
,1,1,,,1,?,Hematology,chemical,small molecule,3,Pomalyst,pomalidomide,2/8/2013,To treat patients with multiple myeloma whose disease progressed after being treated with other cancer drugs.,?,?,,,,D2UX06XLB5,Inhibitor,tumor necrosis factor,"Pomalidomide is a derivative of thalidomide marketed by Celgene, an analogue of thalidomide, is an immunomodulatory agent with antineoplastic activity. In in vitro cellular assays, pomalidomide inhibited proliferation and induced apoptosis of hematopoietic tumor cells. Additionally, pomalidomide inhibited the proliferation of lenalidomide-resistant multiple myeloma cell lines and synergized with dexamethasone in both lenalidomide-sensitive and lenalidomide-resistant cell lines to induce tumor cell apoptosis. Pomalidomide enhanced T cell- and natural killer (NK) cell-mediated immunity and inhibited production of pro-inflammatory cytokines (e.g., TNF-α and IL-6) by monocytes. Pomalidomide demonstrated anti-angiogenic activity in a mouse tumor model and in the in vitro umbilical cord model.",,tumor necrosis factor,ANTINEOPLASTIC AND IMMUNOMODULATING AGENTS,,US Approved Rx
1,1,,,,,2003,Endocrinology,antisense oligo,antisense oligo,2,Kynamro,mipomersen sodium,1/29/2013,To treat patients with a rare type of high cholesterol called homozygous familial hypercholesterolemia (HoFH).,?,?,,,,18EAY4870E,,,,,,,,US Approved Rx
,,,,,,?,Endocrinology,chemical,small molecule,1,Nesina,alogliptin,1/25/2013,To improve blood sugar control in adults with type 2 diabetes.,?,?,,,,JHC049LO86,Inhibitor,Dipeptidyl peptidase 4,"Alogliptin (trade name Nesina in the US and Vipidia in Europe) is an orally administered anti-diabetic drug in the DPP-4 inhibitor class, discovered by Takeda Pharmaceutical Company's wholly owned subsidiary, Takeda San Diego, Inc. (former Syrrx) which was acquired by Takeda in 2005. Alogliptin does not decrease the risk of heart attack and stroke. Like other members of the gliptin class, it causes little or no weight gain, exhibits relatively little risk of causing hypoglycemia, and exhibits relatively modest glucose-lowering activity. Alogliptin and other gliptins are commonly used in combination with metformin in patients whose diabetes cannot adequately be controlled with metformin alone.",,Dipeptidyl peptidase 4,ALIMENTARY TRACT AND METABOLISM,,US Approved Rx
1,,1,,1,,1993,Infectious disease,polymer,polymer,39,Fulyzaq,crofelemer,12/31/2012,"To treat HIV/AIDS patients whose diarrhea is not caused by an infection from a virus, bacteria, or parasite.",?,?,,,,PY79D6C8RX,Inhibitor,Anoctamin-1|Cystic fibrosis transmembrane conductance regulator,"Crofelemer, previously known as the investigational drug SP-303, is a novel proanthocyanidin purified from the bark latex of the Amazonian Croton tree Croton lechleri. It is marketed under the brand name Fulyzaq and indicated for the symptomatic treatment of non-infectious diarrhea in adult patients with HIV/AIDS who are taking antiretroviral therapy. Fulyzaq treats the symptoms of disease, but it is not used to treat infectious diarrhea (diarrhea caused by infection of the digestive system by a bacteria, virus or parasite). It was initially developed by Napo Pharmaceuticals, which licensed it to Glenmark Pharmaceuticals in 140 emerging markets and to Salix Pharmaceuticals in the US, EU and some other markets. A Phase III clinical trial for diarrhoea in HIV patients was completed in 2012, and the drug was approved by the US Food and Drug Administration (FDA) on 31 December 2012.",,Anoctamin-1|Cystic fibrosis transmembrane conductance regulator,,HTS amenable drugs|INN|KEGG|NPC informatics,US Approved Rx
,,,,1,,2004,Cardiology,chemical,small molecule,37,Eliquis,apixaban,12/28/2012,To reduce the risk of stroke and dangerous blood clots (systemic embolism) in patients with atrial fibrillation that is not caused by a heart valve problem.,?,?,,,,3Z9Y7UWC1J,Inhibitor,Coagulation factor X,"Apixaban is an orally active inhibitor of coagulation factor Xa with anticoagulant activity. Apixaban directly inhibits factor Xa, thereby interfering with the conversion of prothrombin to thrombin and preventing formation of cross-linked fibrin clots. Apixaban has been available in Europe since May 2012. An FDA decision on apixaban which was expected on June 28, 2012 was initially delayed before final approval on December 28, 2012. On August 21, 2014, Pfizer announced that apixaban was now FDA approved for treatment and secondary prophylaxis of deep vein thrombosis (DVT) and pulmonary embolism (PE). It is being developed in a joint venture by Pfizer and Bristol-Myers Squibb. It has also been used to lower the risk of developing venous thrombosis post-orthopedic surgical procedures.",Direct Xa inhibitor(-xaban),Coagulation factor X,BLOOD AND BLOOD FORMING ORGANS,KEGG|NPC informatics|Structure undefined|USAN,US Approved Rx
1,1,,,1,1,?,Respiratory,chemical,small molecule,38,Sirturo,bedaquiline,12/28/2012,As part of combination therapy to treat adults with multi-drug resistant pulmonary tuberculosis (TB) when other alternatives are not available.,?,?,,,,78846I289Y,Inhibitor,ATP synthase subunit c,"Bedaquiline (trade name Sirturo, code names TMC207 and R207910) is a diarylquinoline anti-tuberculosis drug, which was discovered by a team led by Koen Andries at Janssen Pharmaceutica. When it was approved by the FDA on the 28th December 2012, it was the first new medicine to fight TB in more than forty years, and is specifically approved to treat multi-drug-resistant tuberculosis. Bedaquiline is a diarylquinoline antimycobacterial drug that inhibits the proton pump of mycobacterial ATP (adenosine 5'-triphosphate) synthase, an enzyme that is essential for the generation of energy in Mycobacterium tuberculosis. Bacterial death occurs as a result of bedaquiline.",Chemical substance(-ine),ATP synthase subunit c,ANTIINFECTIVES FOR SYSTEMIC USE,,US Approved Rx
1,1,,,,,1998,Gastroenterology,protein,peptide,35,Gattex,teduglutide,12/21/2012,To treat adults with short bowel syndrome (SBS) who need additional nutrition from intravenous feeding (parenteral nutrition).,?,?,,,,7M19191IKG,Agonist,Glucagon-like peptide 2 receptor,"Teduglutide is a glucagon-like peptide-2 (GLP-2) analogue. It is made up of 33 amino acids and is manufactured using a strain of Escherichia coli modified by recombinant DNA technology. Teduglutide differs from GLP-2 by one amino acid (alanine is substituted by glycine). The significance of this substitution is that teduglutide is longer acting than endogenous GLP-2 as it is more resistant to proteolysis from dipeptidyl peptidase-4. GLP-2 is known to increase intestinal and portal blood flow, and inhibit gastric acid secretion. Teduglutide binds to the glucagon-like peptide-2 receptors located in intestinal subpopulations of enteroendocrine cells, subepithelial myofibroblasts and enteric neurons of the submucosal and myenteric plexus. Activation of these receptors results in the local release of multiple mediators including insulin-like growth factor (IGF)-1, nitric oxide and keratinocyte growth factor (KGF). FDA approved on December 21, 2012. In Europe it has been granted orphan drug status and is marketed under the brand Revestive by Nycomed. It works by promoting mucosal growth and possibly restoring gastric emptying and secretion.",Peptides and glycopeptides(-tide),Glucagon-like peptide 2 receptor,ALIMENTARY TRACT AND METABOLISM,INN|NPC informatics|Structure undefined,US Approved Rx
1,1,,,,,2005,Endocrinology,chemical,small molecule,36,Juxtapid,lomitapide,12/21/2012,"To reduce low-density lipoprotein (LDL) cholesterol, total cholesterol, apolipoprotein B, and non-high-density lipoprotein (non-HDL) cholesterol in patients with homozygous familial hypercholesterolemia (HoFH).",?,?,,,,82KUB0583F,Inhibitor,Microsomal triglyceride transfer protein large subunit,"Lomitapide (INN, marketed as Juxtapid in the US and as Lojuxta in the EU) is a drug for the treatment of familial hypercholesterolemia, developed by Aegerion Pharmaceuticals. It has been tested in clinical trials as single treatment and in combinations with atorvastatin, ezetimibe and fenofibrate. The US Food and Drug Administration (FDA) approved lomitapide on 21 December 2012, as an orphan drug to reduce LDL cholesterol, total cholesterol, apolipoprotein B, and non-high-density lipoprotein (non-HDL) cholesterol in patients with homozygous familial hypercholesterolemia (HoFH). On 31 May 2013 the European Committee for Medicinal Products for Human Use (CHMP) adopted a positive opinion with a unanimous vote recommending a marketing authorization for lomitapide. On 31 July 2013 the European Commission approved lomitapide as an adjunct to a low-fat diet and other lipid-lowering medicinal products with or without low density lipoprotein (LDL) apheresis in adult patients with HoFH. UXTAPID directly binds and inhibits microsomal triglyceride transfer protein (MTP), which resides in the lumen of the endoplasmic reticulum, thereby preventing the assembly of apo B containing lipoproteins in enterocytes and hepatocytes. This inhibits the synthesis of chylomicrons and VLDL. The inhibition of the synthesis of VLDL leads to reduced levels of plasma LDL-C.",,Microsomal triglyceride transfer protein large subunit,CARDIOVASCULAR SYSTEM,,US Approved Rx
,1,,,1,1,2008,Hematology,chemical,small molecule,32,Iclusig,ponatinib,12/14/2012,"To treat adults with chronic myeloid leukemia (CML) and Philadelphia chromosome positive acute lymphoblastic leukemia (Ph+ ALL), two rare blood and bone marrow diseases.",?,?,,,,4340891KFS,Inhibitor,Breakpoint cluster region protein|Tyrosine-protein kinase ABL1,"Ponatinib (trade name Iclusig, previously AP24534) is developed by ARIAD Pharmaceuticals for the treatment of chronic myeloid leukemia (CML) and Philadelphia chromosome–positive (Ph+) acute lymphoblastic leukemia (ALL). Ponatinib has been designed to be effective against these types of tumors. The United States Food and Drug Administration approved the drug as a candidate in 2012, but temporarily suspended sales on 31 October 2013 because of ""the risk of life-threatening blood clots and severe narrowing of blood vessels"". This suspension was partially lifted on Dec. 20, 2013 with ponatinib being issued revised prescribing information, a new ""Black Box Warning"" and a ""Risk Evaluation and Mitigation Strategy"" in place to better evaluate the risks and benefits of using the drug. Ponatinib is an orally bioavailable multitargeted receptor tyrosine kinase (RTK) inhibitor with potential antiangiogenic and antineoplastic activities. Ponatinib inhibits unmutated and all mutated forms of Bcr-Abl, including T315I, the highly drug therapy-resistant missense mutation of Bcr-Abl. This agent also inhibits other tyrosine kinases including those associated with vascular endothelial growth factor receptors (VEGFRs) and fibroblast growth factor receptors (FGFRs); in addition, it inhibits the tyrosine kinase receptor TIE2 and FMS-related tyrosine kinase receptor-3 (Flt3). RTK inhibition by ponatinib may result in the inhibition of cellular proliferation and angiogenesis and may induce cell death. Bcr-Abl is a fusion tyrosine kinase encoded by the Philadelphia chromosome.",Tyrosine-kinase inhibitors(-tinib),Breakpoint cluster region protein|Tyrosine-protein kinase ABL1,ANTINEOPLASTIC AND IMMUNOMODULATING AGENTS,,US Approved Rx
